ID,CODIGO,USER_NOMBRE,PRODUCT_ID,DIRECCION,PRECIO,"FECHA DE FACTURACION",PEDIDO
12,60527100543,"Carlos admin",100,"Calle rio jucar Nº32, 04230, almeria, almeria",9956.08,"2022-06-02 09:02:07","nulla ut voluptatem rerum perspiciatis reiciendis earum rem"
13,605801003699123816,"Carlos admin","100,36,99,123","Calle rio jucar Nº32, 04230, almeria, almeria",39533.01,"2022-06-02 09:03:00"," nulla ut voluptatem rerum perspiciatis reiciendis earum rem
 ratione fugit corporis provident atque blanditiis in sapiente
 hic molestiae ut voluptatum non aut ullam provident
 porro nisi qui aperiam doloremque ex est tempore"
